,name,address,city,state,latitude,longitude,stars,review_count,categories,is_American,is_Dessert,is_Bar,"is_Beer,Wine,Spirits",is_Breakfast,is_Coffee & Tea,is_Asian,is_Italian,"is_Healthy,Specialty Food",is_Latin American,is_Mediterranean,is_Western European,is_Slavic Food,is_African,is_Food Markets/Shops,rating
TnDyCA5CvrBt2HKouXCa8w,The Burger's Priest,10148 109th Street NW,Edmonton,AB,53.541255,-113.509875,3.5,146,"Restaurants, American (Traditional), Fast Food, Burgers",1,0,0,0,0,0,0,0,0,0,0,0,0,0,0,1
uHFnlYqRinpyS-EozlZFAA,It' Dog,8621 109th Street NW,Edmonton,AB,53.5224936596,-113.5118113963,3.5,70,"Chicken Shop, Chicken Wings, Hot Dogs, Food, Restaurants, Korean",1,0,0,0,0,0,1,0,0,0,0,0,0,0,1,1
GpFRwCHN0RI8yFbcfXjfUg,V Sandwiches,10127 100A Street NW,Edmonton,AB,53.5417173,-113.4919398,3.5,9,"Vietnamese, Sandwiches, Restaurants",1,0,0,0,0,0,1,0,0,0,0,0,0,0,0,1
MBtoji84lhvTCRTjfLwTDw,Tim Hortons,10310 31ST Avenue NW,Edmonton,AB,53.4637602,-113.4931564,2.5,6,"Delis, Sandwiches, Food, Restaurants, Coffee & Tea",1,0,0,0,0,1,0,0,0,0,0,0,0,0,0,1
5bcngipnLPwSR9mDbA2ahA,Greta,10141 109 Street NW,Edmonton,AB,53.542038,-113.5080027,3.0,8,"Bars, Arts & Entertainment, Nightlife, Arcades, Restaurants",0,0,1,0,0,0,0,0,0,0,0,0,0,0,0,2
ivpULDSBS4mP3mJqmziKQw,Cafe Amore Bistro,10807 106 Avenue NW,Edmonton,AB,53.5496883,-113.5068932,4.5,123,"Italian, Restaurants, Cafes",0,0,0,0,0,1,0,1,0,0,0,0,0,0,0,2
2rt7k-vLmXXqzP2UForL2w,Yokozuna Japanese Restaurant,4121 106 Street NW,Edmonton,AB,53.4783873,-113.5040267,4.0,95,"Sushi Bars, Japanese, Restaurants",0,0,1,0,0,0,1,0,0,0,0,0,0,0,0,3
F5b99wMsfB_TpUBye-iOeg,Kobe Japanese Bistro,516-6655-178 Street NW,Edmonton,AB,53.502949826,-113.628151625,4.0,50,"Sushi Bars, Japanese, Restaurants",0,0,1,0,0,0,1,0,0,0,0,0,0,0,0,3
42zgRbWS-2t6DkENW_rOzw,Watari,10108 124 Street,Edmonton,AB,53.5422833785,-113.5360898393,3.0,70,"Buffets, Japanese, Sushi Bars, Restaurants",1,0,1,0,0,0,1,0,0,0,0,0,0,0,0,4
YNcVAMg2u10Bad8qiFE-tw,Teriyaki Corner Japanese Bistro,1064-91 Street SW,Edmonton,AB,53.4232221789,-113.4767168058,3.5,29,"Japanese, Restaurants",0,0,0,0,0,0,1,0,0,0,0,0,0,0,0,4
XnI4rF-RUzJaRhogyVxIEA,The Burger's Priest,2125 98th Street NW,Edmonton,AB,53.452251,-113.4837136,3.0,56,"Restaurants, Burgers",1,0,0,0,0,0,0,0,0,0,0,0,0,0,0,4
n6up3A47D8FIyKcdPDWzuQ,Jumbo Dim Sum Dining,10451 170 Street NW,Edmonton,AB,53.548429,-113.614088,4.0,104,"Restaurants, Chinese, Dim Sum",0,0,0,0,0,0,1,0,0,0,0,0,0,0,0,4
a-dvm-J7qPKGRRxFXBG56Q,Kazoku Ramen,16518 100 Avenue NW,Edmonton,AB,53.539669,-113.607027,3.5,91,"Japanese, Restaurants, Ramen, Asian Fusion",0,0,0,0,0,0,1,0,0,0,0,0,0,0,0,4
ZcYFylbiFArKxpOQWxkIBQ,Mikado - Downtown,10350 109 Street NW,Edmonton,AB,53.5457663,-113.5088813,4.0,81,"Japanese, Restaurants, Sushi Bars",0,0,1,0,0,0,1,0,0,0,0,0,0,0,0,4
7SrKS3L6lRAfDU8FFqQe_g,Freshii,"8882 170 St NW, Phase 3, Food Court",Edmonton,AB,53.5224397,-113.6218712,3.0,21,"Restaurants, Fast Food, Vegetarian, Soup, Sandwiches, Salad",1,0,0,0,0,0,0,0,1,0,0,0,0,0,0,4
TJjQFgDUSR_B5ndK_T_6_w,JOEY South Common,9911 19 Ave NW,Edmonton,AB,53.447395,-113.485626,3.5,98,"Mediterranean, American (Traditional), Restaurants, Lounges, Bars, Nightlife, Canadian (New)",1,0,1,0,0,0,0,0,0,0,1,0,0,0,0,4
7lYEpGuGKqh69ik7_ZKbpQ,The Keg Steakhouse + Bar,9960 170 St Nw,Edmonton,AB,53.5374674,-113.6161144,4.5,66,"Nightlife, Steakhouses, Bars, Restaurants, Seafood",1,0,1,0,0,0,0,0,0,0,0,0,0,0,1,4
KkIHmOm9rl-2sQ63Ixdwhg,Ichiban Restaurant Japanese Cuisine,8750 149 Street NW,Edmonton,AB,53.520778,-113.578488,4.0,48,"Restaurants, Japanese, Sushi Bars",0,0,1,0,0,0,1,0,0,0,0,0,0,0,0,4
hO1I7SjpY-DopwNgRvbFuQ,Earls Kitchen + Bar,"8882 170th Street, Bourbon Street, Unit W-143 (#1667)",Edmonton,AB,53.523957,-113.623788,3.5,81,"Comfort Food, American (Traditional), Bars, Nightlife, Cocktail Bars, Canadian (New), American (New), Restaurants",1,0,1,0,0,0,0,0,0,0,0,0,0,0,0,4
Cr-uaPrfvG7tvqzLGAGErA,Kyoto Japanese Cuisine,8701 109 Street NW,Edmonton,AB,53.5231333193,-113.5113531433,3.5,58,"Japanese, Restaurants, Sushi Bars, Asian Fusion",0,0,1,0,0,0,1,0,0,0,0,0,0,0,0,4
swUT7AsP776D0XEBQrSznA,Bubba Gump Shrimp Co.,2393-8882 170 St NW,Edmonton,AB,53.5224467245,-113.627608,2.5,132,"Restaurants, Seafood",0,0,0,0,0,0,0,0,0,0,0,0,0,0,1,4
36F6K3PGGV2ICZBNDoh0wg,Baijiu,103-10359 104 Street NW,Edmonton,AB,53.545881,-113.499053,4.5,44,"Restaurants, Nightlife, Cocktail Bars, Asian Fusion, Bars",0,0,1,0,0,0,1,0,0,0,0,0,0,0,0,4
Qx32u-8jRlbDEXCQrRT-RA,Tanuki Kyoto Japanese Cuisine,10128 109 Street NW,Edmonton,AB,53.5411894276,-113.509348603,3.5,102,"Japanese, Sushi Bars, Restaurants",0,0,1,0,0,0,1,0,0,0,0,0,0,0,0,5
I2Ipf82-rbAwh0I-X9T0gg,Lotus Cafe,10321 124 Street NorthWest,Edmonton,AB,53.5452679833,-113.5357645154,4.5,6,"Restaurants, Cafes, Persian/Iranian, Grocery, Food, Caterers, Middle Eastern, Bakeries, Event Planning & Services, Venues & Event Spaces",0,1,0,0,0,1,0,0,0,0,1,0,0,0,1,5
FM81cYp1irTPZTKD-bXWzw,Sunbake Pita Bakery,10728 134 Ave NW,Edmonton,AB,53.5952957,-113.5063065,4.5,63,"Middle Eastern, Pizza, Bakeries, Food, Lebanese, Restaurants, Halal",0,1,0,0,0,0,0,1,0,0,1,0,0,0,0,5
TnDyCA5CvrBt2HKouXCa8w,The Burger's Priest,10148 109th Street NW,Edmonton,AB,53.541255,-113.509875,3.5,146,"Restaurants, American (Traditional), Fast Food, Burgers",1,0,0,0,0,0,0,0,0,0,0,0,0,0,0,5
42zgRbWS-2t6DkENW_rOzw,Watari,10108 124 Street,Edmonton,AB,53.5422833785,-113.5360898393,3.0,70,"Buffets, Japanese, Sushi Bars, Restaurants",1,0,1,0,0,0,1,0,0,0,0,0,0,0,0,5
N-ej51lLtIl4TMC-Qb3k4A,Zen All-You-Can-Eat Sushi & Grill,7618 104 Street NW,Edmonton,AB,53.5129039,-113.4982425,3.0,90,"Restaurants, Sushi Bars, Japanese",0,0,1,0,0,0,1,0,0,0,0,0,0,0,0,5
2_qvUdA1EYMVj0N_vAz0Bw,Szechuan Sweet Mango,9120 82 Avenue NW,Edmonton,AB,53.5183917,-113.4685595,4.0,44,"Asian Fusion, Restaurants, Thai, Chinese, Vietnamese",0,0,0,0,0,0,1,0,0,0,0,0,0,0,0,5
yUcRRm3xtgqkABMlF6xanQ,Banzai Restaurant,4608 Calgary Trail NW,Edmonton,AB,53.4842874,-113.4955778,3.0,54,"Sushi Bars, Restaurants, Japanese, Fast Food",1,0,1,0,0,0,1,0,0,0,0,0,0,0,0,5
8wjRidyw7pqepAf5MncA-g,Tokiwa Ramen,11978 104 Avenue,Edmonton,AB,53.547523338,-113.5277542096,4.0,109,"Restaurants, Japanese, Ramen, Soup",1,0,0,0,0,0,1,0,0,0,0,0,0,0,0,5
5nlpLTaOXgDQgKBHhAzm2g,The Burger Joint,9132   23 Avenue,Edmonton,AB,53.452698,-113.4697591,4.0,87,"Fast Food, Restaurants, Burgers",1,0,0,0,0,0,0,0,0,0,0,0,0,0,0,5
GjK8fBJO3sE9vYkK0RE7Jw,Lemongrass Cafe,10417 51 Avenue NW,Edmonton,AB,53.4874321048,-113.4983166271,4.0,62,"Chinese, Restaurants, Vietnamese, Cafes",0,0,0,0,0,1,1,0,0,0,0,0,0,0,0,5
QUk44voqlOHdGMX852F2Rg,Cactus Club Cafe,11130 Jasper Avenue,Edmonton,AB,53.54121201,-113.5132776,4.0,156,"Restaurants, Lounges, Canadian (New), Cocktail Bars, Food, American (Traditional), Food Delivery Services, Nightlife, Bars",1,0,1,0,0,0,0,0,0,0,0,0,0,0,1,5
fsE2w3GzeO84tdIWf9TL4w,Blaze Pizza,12010 104 Ave NW,Edmonton,AB,53.554091,-113.527985,4.5,63,"Fast Food, Restaurants, Salad, Pizza",1,0,0,0,0,0,0,1,1,0,0,0,0,0,0,5
BORvYBcXG-VbwNBylwUInA,Cafe Blackbird,9640 142 Street,Edmonton,AB,53.533929,-113.566981,4.0,66,"Breakfast & Brunch, Restaurants, Coffee & Tea, Food, Bars, Nightlife, Sandwiches, Cafes, Wine Bars",1,0,1,1,1,1,0,0,0,0,0,0,0,0,0,5
_SBxweaeZORapKBJa2qmOw,Little Brick,10004  90th Street,Edmonton,AB,53.5421204,-113.4696156,4.0,85,"Cafes, Coffee & Tea, Restaurants, Shopping, Convenience Stores, Food, Flowers & Gifts, Gift Shops",0,0,0,0,0,1,0,0,0,0,0,0,0,0,0,5
5DFvFAo3zI7sMPspDZKGNg,A&W,220 Mayfield Common NW,Edmonton,AB,53.5416335,-113.610427,3.0,13,"Breakfast & Brunch, Burgers, Restaurants, Fast Food",1,0,0,0,1,0,0,0,0,0,0,0,0,0,0,5
qnZnegQQ7swK1xBzQaEVNw,Vivo Ristorante,18352 Lessard Rd,Edmonton,AB,53.485728,-113.6421059,4.0,100,"Italian, Restaurants",0,0,0,0,0,0,0,1,0,0,0,0,0,0,0,5
ICmLHwqo910dgvx15sztEw,Situation Brewing,10308 81 Avenue NW,Edmonton,AB,53.517236262,-113.4950723872,4.0,89,"Breweries, Food, Hotels & Travel, Restaurants, Breakfast & Brunch, Tours, Beer Tours, Pubs, Nightlife, Bars, Beer, Wine & Spirits, American (Traditional)",1,0,1,1,1,0,0,0,0,0,0,0,0,0,0,5
ggmN08IvJVrzNlhbkeLQgA,Saratoga Restaurant,2610 Calgary Trail NW,Edmonton,AB,53.4573449,-113.4939647,3.5,32,"Restaurants, Breakfast & Brunch, Diners",1,0,0,0,1,0,0,0,0,0,0,0,0,0,0,5
jEvoDXtF3xMJsiPPbqGSmw,Tres Carnales Taqueria,10119 100A St,Edmonton,AB,53.5414338,-113.4918157,4.0,429,"Restaurants, Mexican",0,0,0,0,0,0,0,0,0,1,0,0,0,0,0,5
KMb0sa-n9D-f5Ua1KWP3Pw,Yeg Burger,15131 121 Street NW,Edmonton,AB,53.613341,-113.529668,4.0,47,"Restaurants, Burgers",1,0,0,0,0,0,0,0,0,0,0,0,0,0,0,5
19M-U99uz7UDnJWhgET7TQ,Boardwalk,"3803 Calgary Trail NW, 546",Edmonton,AB,53.4703807797,-113.4926612487,4.0,20,"Burgers, American (Traditional), Halal, Restaurants",1,0,0,0,0,0,0,0,0,0,1,0,0,0,0,5
H__s8RupBhI2F7A2jr0sOw,Pagolac Restaurant,7137 Argyll Rd NW,Edmonton,AB,53.5093802,-113.4392337,4.0,53,"Chinese, Restaurants, Vietnamese",0,0,0,0,0,0,1,0,0,0,0,0,0,0,0,5
ROiQ3grJJWGjY3OecJNrYw,Dairy Queen Grill & Chill,"10421 51st Ave, South Trail Corners",Edmonton,AB,53.4875677,-113.4984616935,2.0,17,"Restaurants, Fast Food, Burgers, Ice Cream & Frozen Yogurt, Food",1,1,0,0,0,0,0,0,0,0,0,0,0,0,0,5
FIDssW_SyTzhpcm4unCTGw,Julio's Barrio Mexican Restaurant,10450 82 Avenue NW,Edmonton,AB,53.5183012,-113.499604,3.0,173,"Nightlife, Bars, Pubs, Mexican, Restaurants",0,0,1,0,0,0,0,0,0,1,0,0,0,0,0,5
pqZYSvF_qrmCjkr6frf4RQ,Meat,8216 104 Street,Edmonton,AB,53.5186257,-113.4976661,4.0,420,"Southern, Barbeque, Restaurants, Breakfast & Brunch, Sandwiches, Canadian (New)",1,0,0,0,1,0,0,0,0,0,0,0,0,0,0,5
0s9wc8XMhxgKbiHUreqeRw,Hanjan,3735 99 Street NW,Edmonton,AB,53.471242,-113.4852161,4.0,99,"Cafes, Nightlife, Restaurants, Pubs, Bars, Korean",0,0,1,0,0,1,1,0,0,0,0,0,0,0,0,5
M46S2RMvCunEvkPBdvnneA,The Three Amigos,4035 106 Street NW,Edmonton,AB,53.4755251,-113.5045946,3.5,92,"Mexican, Restaurants",0,0,0,0,0,0,0,0,0,1,0,0,0,0,0,5
fdez0D4ovth2k1IvR0ZbpQ,Sabor,10220 103 Street,Edmonton,AB,53.5433810872,-113.4976051483,4.0,141,"Seafood, Restaurants, Mediterranean, Italian, Iberian, Spanish, Portuguese",0,0,0,0,0,0,0,1,0,1,1,1,1,0,1,5
YRXh29U8FiZt8n-5fe-wuA,Freshii,"106-11928 104th Ave NW, Unit 106",Edmonton,AB,53.5467718448,-113.5270748287,4.0,6,"Restaurants, Food, Ice Cream & Frozen Yogurt, Salad, Specialty Food, Vegetarian, Fast Food, Breakfast & Brunch",1,1,0,0,1,0,0,0,1,0,0,0,0,0,0,5
O-UOybvMutXl97R3dlvkyA,Blaze Pizza,1338 99 Street NW,Edmonton,AB,53.4425156,-113.4832826,4.0,42,"Fast Food, Restaurants, Salad, Pizza",1,0,0,0,0,0,0,1,1,0,0,0,0,0,0,5
Tqt99-TsbRT4bmsXHyA1lA,Rostizado - by Tres Carnales,"10359 104 Street NW, Suite 102",Edmonton,AB,53.5460453,-113.4991693,4.0,186,"Restaurants, Mexican",0,0,0,0,0,0,0,0,0,1,0,0,0,0,0,5
2fTfpN5SggLgW4LlzptMPg,Tzin Wine & Tapas,10115 104 Street Northwest,Edmonton,AB,53.5410214625,-113.4992408752,4.5,116,"Nightlife, Beer, Wine & Spirits, Tapas Bars, Wine Bars, Restaurants, Food, Bars",0,0,1,1,0,0,0,0,0,0,0,0,0,0,0,5
6RyyMSq4T5G8mILUaALHfw,Italian Centre Shop,5028 104A Street NW,Edmonton,AB,53.487472,-113.4997548,4.0,71,"Food, Ethnic Food, Delicatessen, Delis, International Grocery, Italian, Specialty Food, Pizza, Restaurants, Grocery",1,0,0,0,0,0,0,1,1,0,0,0,0,0,1,5
XjST6nGKZ7K_Sb6wKfCPDw,Chocolaterie Bernard Callebaut,10103 - 124th Street,Edmonton,AB,53.5417917,-113.5353511,4.0,40,"Food, Desserts, Ice Cream & Frozen Yogurt, Specialty Food, Chocolatiers & Shops, Coffee & Tea, Restaurants, Cafes",0,1,0,0,0,1,0,0,1,0,0,0,0,0,0,5
