,name,address,city,state,latitude,longitude,stars,review_count,categories,is_American,is_Dessert,is_Bar,"is_Beer,Wine,Spirits",is_Breakfast,is_Coffee & Tea,is_Asian,is_Italian,"is_Healthy,Specialty Food",is_Latin American,is_Mediterranean,is_Western European,is_Slavic Food,is_African,is_Food Markets/Shops,rating
haYikT8axUlLyNS7k-osng,McDonald's,801 E Grant,Tucson,AZ,32.250857,-110.959918,1.5,57,"Fast Food, Restaurants, Burgers, Food, Coffee & Tea",1,0,0,0,0,1,0,0,0,0,0,0,0,0,0,1
x3pTbsABLypwEoTdwQOmSg,El Molinito Restaurant,2323 N Pantano Rd,Tucson,AZ,32.249254,-110.8243254,2.5,158,"Event Planning & Services, Caterers, Mexican, Restaurants",0,0,0,0,0,0,0,0,0,1,0,0,0,0,1,2
HUhlFVMjZOgj1-N0JmCo-g,Brother John's Beer Bourbon & BBQ,1801 N Stone Ave,Tucson,AZ,32.243993,-110.972209,3.5,555,"Arts & Entertainment, Nightlife, Bars, Music Venues, Beer Gardens, American (Traditional), Restaurants, Sandwiches, Barbeque",1,0,1,1,0,0,0,0,0,0,0,0,0,0,0,3
u6P6I5PZnSlnILY5nFWBJA,Calle Tepa,6151 E Broadway,Tucson,AZ,32.2220412599,-110.8609629602,4.0,721,"Beer, Wine & Spirits, Mexican, Food, Restaurants",0,0,0,1,0,0,0,0,0,1,0,0,0,0,0,3
pqHCY2NE8_aVl0EsDRbUtg,Famous Dave's Bar-B-Que,3007 East Speedway Blvd,Tucson,AZ,32.2365006015,-110.9278679,3.0,184,"Barbeque, Restaurants, Comfort Food, American (Traditional)",1,0,0,0,0,0,0,0,0,0,0,0,0,0,0,3
0z-pNv_92L_-LiYV_XlcSw,Brawley's Restaurant,7848 E Wrightstown Rd,Tucson,AZ,32.2502273843,-110.8243817836,3.5,90,"Food, Do-It-Yourself Food, Breakfast & Brunch, Restaurants",0,0,0,0,1,0,0,0,0,0,0,0,0,0,1,3
p8Lbf6wqRJwRasSh12G09Q,Burger King,454 W Grant,Tucson,AZ,32.2506844,-110.9798387092,2.5,13,"Hot Dogs, Burgers, Restaurants, Fast Food",1,0,0,0,0,0,0,0,0,0,0,0,0,0,0,3
QOc3pCNWs8Z7o-w4bgY6AQ,New China Sushi Grill Buffet,1160 N Wilmot Rd,Tucson,AZ,32.2368983,-110.8572943,2.5,136,"Sushi Bars, Restaurants, Asian Fusion, Chinese, Buffets",1,0,1,0,0,0,1,0,0,0,0,0,0,0,0,3
HJ59vXwm0gsS-w6lY9MEXA,Pei Wei Asian Kitchen,"5285 E Broadway Blvd, Ste 151",Tucson,AZ,32.2220548147,-110.8796491822,3.0,135,"Chinese, Asian Fusion, Restaurants, Fast Food, Gluten-Free",1,0,0,0,0,0,1,0,1,0,0,0,0,0,1,3
4jkH3istYst8zxLxb-QVmg,La Parrilla Suiza,5602 E Speedway Blvd,Tucson,AZ,32.236014,-110.872951,3.0,340,"Mexican, Restaurants",0,0,0,0,0,0,0,0,0,1,0,0,0,0,0,4
jpLJ79SPYXMpbvZ0py3uiw,Sullivan's Eatery and Creamery,6444 N Oracle Rd,Tucson,AZ,32.3231932,-110.9730401,4.0,256,"American (Traditional), Food, Sandwiches, Restaurants, Ice Cream & Frozen Yogurt, Burgers, Diners",1,1,0,0,1,0,0,0,0,0,0,0,0,0,0,4
mvXtwW5Cj7u_CRaHQpTghg,Village Inn,9560 E 22nd St,Tucson,AZ,32.2058814,-110.7886566,3.0,69,"Restaurants, Breakfast & Brunch, Diners, American (New), American (Traditional)",1,0,0,0,1,0,0,0,0,0,0,0,0,0,0,4
tszRCO-RchPXPZlsTCYgbA,"Guadalajara Grill - Fiesta, Best Mexican Restaurant in Tucson",750 N Kolb Rd,Tucson,AZ,32.2305673,-110.8404372,3.0,555,"Mexican, Restaurants, Tex-Mex, Caterers, Event Planning & Services, Seafood",1,0,0,0,0,0,0,0,0,1,0,0,0,0,1,4
j8feOxyJqlIJWOi8su2qzw,Serial Grillers,5975 E Speedway Blvd,Tucson,AZ,32.236675,-110.865028,4.5,986,"Cheesesteaks, Food, Salad, Restaurants, Sandwiches, Pizza, Breweries",1,0,0,1,0,0,0,1,1,0,0,0,0,0,0,4
7Y63Pa3gQfxfI0KX2hKExA,Jewel’s Noodle Kitchen,5683 E Speedway Blvd,Tucson,AZ,32.236697,-110.871226,4.5,96,"Restaurants, Chinese",0,0,0,0,0,0,1,0,0,0,0,0,0,0,0,4
a8q8Kd7KubA-qHpPAAH81g,Sauce Pizza & Wine,5285 E Broadway Blvd,Tucson,AZ,32.2220412,-110.8796465,4.0,226,"Pizza, Restaurants, Bars, Nightlife, Italian, Salad, Wine Bars",0,0,1,1,0,0,0,1,1,0,0,0,0,0,0,4
5qQDuBFzK-Y3m3viZ2LxPg,Grandma Tony's Pizza,"7878 E Wrightstown Rd, Ste 150",Tucson,AZ,32.2499529465,-110.824080416,4.0,40,"Pizza, Restaurants",0,0,0,0,0,0,0,1,0,0,0,0,0,0,0,4
cHZ1FUswyko119EkV_9aNQ,Upper Crust Pizza,1909 E Grant Rd,Tucson,AZ,32.250429,-110.943524,3.5,180,"Salad, Pizza, Chicken Wings, Restaurants",1,0,0,0,0,0,0,1,1,0,0,0,0,0,0,4
ac2PPDX41fyhsiQYj3vOgw,Tropical Smoothie Cafe,10230 E Old Vail Rd,Tucson,AZ,32.0879513406,-110.7744220466,4.0,18,"Food, Sandwiches, Juice Bars & Smoothies, Restaurants",1,0,1,0,0,0,0,0,1,0,0,0,0,0,0,4
4KscCdMdkfSZZOn1qQOxzA,Glory Days Grill,14457 N Dale Mabry Hwy,Tampa,FL,28.0799906,-82.5060255,3.5,126,"American (Traditional), Nightlife, Chicken Wings, Sports Bars, Restaurants, Bars",1,0,1,0,0,0,0,0,0,0,0,0,0,0,0,4
wF3EdgYbUm6ARXDCzbpUEA,Panera Bread,6129 E Broadway Blvd,Tucson,AZ,32.222119,-110.861308,2.5,109,"Salad, Bakeries, Food, Restaurants, Cafes, Sandwiches, Soup",1,1,0,0,0,1,0,0,1,0,0,0,0,0,0,4
jEAqMCGw3ocephZJFsl-qw,Divine Bovine Burgers,1021 N Wilmot St,Tucson,AZ,32.234791,-110.8583345,4.5,294,"Beer Bar, Bars, Nightlife, Restaurants, Burgers",1,0,1,1,0,0,0,0,0,0,0,0,0,0,0,4
LRr-aw58xVMkUu0OSL_BpQ,The Little One,151 N Stone Ave,Tucson,AZ,32.2241254,-110.9718282,4.5,347,"Restaurants, Mexican, Breakfast & Brunch, Latin American",0,0,0,0,1,0,0,0,0,1,0,0,0,0,0,5
zZ01WQlcpI1_n806WKV3bA,Culinary Dropout,2543 E Grant Rd,Tucson,AZ,32.2507627,-110.9341315,4.0,1295,"Restaurants, American (New)",1,0,0,0,0,0,0,0,0,0,0,0,0,0,0,5
f82dhKNiUXsDVPMLqKYiIQ,Sher-e-Punjab,853 East Grant Rd,Tucson,AZ,32.2509598946,-110.9591583204,4.0,446,"Restaurants, Salad, Pakistani, Indian, Cocktail Bars, Food, Food Delivery Services, Soup, Halal, Bars, Nightlife",1,0,1,0,0,0,0,0,1,0,1,0,0,0,1,5
1dLWCD6CjSHD7PTfi5ZVNQ,Dao's Tai Pan's,446 N Wilmot Rd,Tucson,AZ,32.2269694,-110.857271,3.5,240,"Vietnamese, Restaurants, Korean, Thai, Chinese",0,0,0,0,0,0,1,0,0,0,0,0,0,0,0,5
ocjotK9u5F3E4CVXD_iNPw,Salsa Verde Restaurant,210 N Pantano Rd,Tucson,AZ,32.2234628,-110.8234174,4.5,321,"Restaurants, Mexican",0,0,0,0,0,0,0,0,0,1,0,0,0,0,0,5
zlfydjffYAIEj6vsh8tVvQ,Tino's Pizza,6610 E Tanque Verde Rd,Tucson,AZ,32.2465891,-110.8514672,4.0,109,"Italian, Pizza, Restaurants, Salad, Sandwiches",1,0,0,0,0,0,0,1,1,0,0,0,0,0,0,5
8P5wSj-51aqqc-jC31RK9g,Filiberto's,7031 E Tanque Verde Rd,Tucson,AZ,32.2512567,-110.8421369,4.0,23,"Mexican, Restaurants",0,0,0,0,0,0,0,0,0,1,0,0,0,0,0,5
0Xm1wedwnMJ1iKXz8vUDSw,The Canyon's Crown,6958 E Tanque Verde Rd,Tucson,AZ,32.2501831502,-110.8432853222,4.0,304,"Sports Bars, Bars, British, Restaurants, Pubs, Fish & Chips, Nightlife",0,0,1,0,0,0,0,0,0,0,0,1,0,0,0,5
NvaLV6FYt0bax2iKvuYYZQ,Graze Premium Burgers,5635 E Broadway Blvd,Tucson,AZ,32.2220041,-110.8716137,4.0,141,"Burgers, Restaurants",1,0,0,0,0,0,0,0,0,0,0,0,0,0,0,5
r17L7AdFR4A9BUoWzv2POw,Taco Giro,9165 E Tanque Verde Rd,Tucson,AZ,32.2581263391,-110.7970301076,3.5,58,"Mexican, Seafood, Soup, Restaurants",1,0,0,0,0,0,0,0,0,1,0,0,0,0,1,5
7stknIh9GW-3sUK8zhv5Ow,Crossroads Restaurant,2602 S 4th Ave,Tucson,AZ,32.1922419,-110.9655193,3.5,165,"Seafood, Restaurants, Mexican",0,0,0,0,0,0,0,0,0,1,0,0,0,0,1,5
QpAVPiH1Yujksd_ReL-x-g,Inca's Peruvian Cuisine,"6878 E Sunrise Dr, Ste 130",Tucson,AZ,32.3074071,-110.8458819,4.0,293,"Restaurants, Peruvian, Seafood, Latin American",0,0,0,0,0,0,0,0,0,1,0,0,0,0,1,5
wIXYreqGaO5AEVjNQulbKQ,Poco & Moms,7000 E Tanque Verde Rd,Tucson,AZ,32.2501557,-110.8429984,4.0,464,"Restaurants, Diners, Food, Sports Bars, American (Traditional), Breakfast & Brunch, Mexican, Event Planning & Services, Venues & Event Spaces, Nightlife, New Mexican Cuisine, Bars",1,0,1,0,1,0,0,0,0,1,0,0,0,0,0,5
JHxfEDW05_KSTfk-SLqXGw,Indian Twist,4660 E Camp Lowell Dr,Tucson,AZ,32.2648159,-110.8930879,4.5,383,"Restaurants, Indian, Seafood, Bars, Pakistani, Food, Coffee & Tea, Nightlife",0,0,1,0,0,1,0,0,0,0,0,0,0,0,1,5
